{
  "eidolon": "my-eidolon",
  "version": "0.1.0",
  "methodology": "MyEidolon",
  "installed_at": "2026-05-25T12:00:00Z",
  "target": "./.eidolons/my-eidolon",
  "hosts_wired": ["claude-code"],
  "files_written": [
    {
      "path": "./.eidolons/my-eidolon/agent.md",
      "sha256": "0000000000000000000000000000000000000000000000000000000000000000",
      "role": "entry-point",
      "mode": "created"
    },
    {
      "path": ".claude/agents/my-eidolon.md",
      "sha256": "1111111111111111111111111111111111111111111111111111111111111111",
      "role": "dispatch",
      "mode": "created"
    }
  ],
  "token_budget": {
    "entry": 420,
    "working_set_target": 1000
  }
}
